{
  "schemaVersion": "research_signal_batch_v1",
  "signalBatchId": "tnm-manual-20260812203851-signals",
  "runId": "tnm-manual-20260812203851",
  "createdAt": "2026-08-12T20:48:51.668Z",
  "watermarkStart": "2026-08-12T20:38:51.441Z",
  "watermarkEnd": "2026-08-12T20:48:52.668Z",
  "sourceFamilyCounters": {
    "official_company": 0,
    "government_procurement": 0,
    "source_book": 0,
    "ecosystem_program": 0,
    "industry_publication": 0,
    "gmail_newsletter": 0,
    "linkedin_chrome": 0,
    "other_discovery": 0
  },
  "warnings": [
    "No qualified dated company-development signal was created; the TSB occurrence is retained as a dossier warning, not misclassified as an award or operating update."
  ],
  "signals": []
}
