{
  "schemaVersion": "research_signal_batch_v1",
  "signalBatchId": "tnm-manual-20260820075716-signal-batch",
  "runId": "tnm-manual-20260820075716",
  "createdAt": "2026-08-20T08:19:11.223Z",
  "watermarkStart": "2026-08-20T07:57:16.070Z",
  "watermarkEnd": "2026-08-20T08:19:11.223Z",
  "sourceFamilyCounters": {
    "official_company": 0,
    "government_procurement": 0,
    "source_book": 0,
    "ecosystem_program": 0,
    "industry_publication": 0,
    "gmail_newsletter": 0,
    "linkedin_chrome": 0,
    "other_discovery": 0
  },
  "signals": [],
  "warnings": [
    "No signal was promoted from this residual dossier wave. The decision-relevant findings require canonical record repair, retirement, merge or successor handling before an organization refresh can be safely attributed."
  ]
}
